00000017036;Теплоноситель Этиленгликоль Технология Уюта-65 10кг канистра  Технология Уюта;5;Котлы и водонагреватели;Комплектующие и аксессуары для котлов;Технология Уюта;S;P2;540,59;792;0606-00095;0;0
00000017058;Резьба сталь Ду65 из труб по ГОСТ 3262-75 КАЗ;32;Трубопроводы и соединительные части;Труба стальная и соединительные части;КАЗ;S;P2;40,33;70;0101-00692;@;0
b0000000062;Муфта ПНД компрессия  Дн32х1 1/4" НР ТПК-АКВА 53003214;12;Трубопроводы и соединительные части;Труба полиэтиленовая (ПЭ, ПНД) и соединительные части;ТПК-АКВА;S;D0;22,59;33;0107-00827;@;0
b0100036113;Комплект для радиатора  VGB101 монтажн 1/2" унив в блистере б/кроншт GABI;44;Отопительное оборудование;Радиаторы;GABI;S;D0;155,3;247;0502-02399;&;0
b0100036114;Комплект для радиатора  VGB102 монтажн 1/2" унив в блистере 4 кроншт. GABI;85;Отопительное оборудование;Радиаторы;GABI;S;D0;238,53;381;0502-02400;&;0
b0100036115;Комплект для радиатора  VGB201 монтажн 3/4" унив в блистере б/кроншт GABI;45;Отопительное оборудование;Радиаторы;GABI;S;D2;155,3;247;0502-02401;&;0
b0100036116;Комплект для радиатора  VGB202 монтажн 3/4" унив в блистере 4 кроншт. GABI;82;Отопительное оборудование;Радиаторы;GABI;S;D1;238,53;381;0502-02402;&;0
b0200039192;Кран PP-R шаровой Дн20 мини ПК Контур 011102020000;100;Трубопроводы и соединительные части;Труба полипропиленовая (PP-R)и соединительные части;ПК Контур;Z;D0;61,48;132,2;0105-01316;@;0
b0100032107;Сифон для ванны 1 1/2"х50 трубный с гофрой нерж/сетка АНИ E155;21;Сантехника;Комплектующие и аксессуары к сантехнике;АНИ;S;D0;192,36;287;0908-00029;&;0
b0100032235;Гильза сталь для бим/термометра  L=60мм п/привар  защитная Wika 8600445;8;Приборы учета и КИП;Комплектующие для КИП;Wika;Z;D0;341,81;453;0702-00038;&;0
b0100032257;Клапан запорн чугун 15кч18п Ду20 Ру16 ВР/ВР КНР;71;Запорная арматура;Клапаны;КНР;S;P2;118,05;173;0304-00088;&;0
b0100013308;Воздухоотводчик Ду15 угл авт Itap 364;1;Отопительное оборудование;Воздухоотводчики;Itap;S;P2;168,25;355;0504-00065;0;0
b0100010094;Шпилька сталь оц М12х1000;23;Трубопроводы и соединительные части;Крепежные изделия;_;S;P2;59;88;0112-00110;@;0
b0100010097;Прокладка кольцевая паронит Ду15 Ру10-40  ГОСТ 15180-86;11;Изоляция и уплотнение;Уплотнительные материалы;_;S;D0;1,14;4;1002-00021;&;0
b0100010100;Прокладка кольцевая паронит Ду20 Ру10-40  ГОСТ 15180-86;73;Изоляция и уплотнение;Уплотнительные материалы;_;S;P2;1,58;4;1002-00022;&;0
b0100010128;Труба PP-RGF арм стекловолокном белый Дн40х6,7 Ру25 80C L=4м ПК Контур 010220040000;1 432;Трубопроводы и соединительные части;Труба полипропиленовая (PP-R)и соединительные части;ПК Контур;S;D0;106,09;246,7;0105-00643;@;0
b0100010160;Труба PP-RGF арм стекловолокном белый Дн50х8,3 Ру25 80C L=4м ПК Контур 010220050000;948;Трубопроводы и соединительные части;Труба полипропиленовая (PP-R)и соединительные части;ПК Контур;S;D0;169,24;393,6;0105-01140;@;0
b0100010161;Труба PP-RGF арм стекловолокном белый Дн63х10,5 Ру25 90C L=4м ПК Контур 010220063000;332;Трубопроводы и соединительные части;Труба полипропиленовая (PP-R)и соединительные части;ПК Контур;S;D2;301,09;647,5;0105-01141;@;0
b0100010195;Труба PP-R белый Дн25х2,3 Ру10 40C L=4м ПК Контур 010100025000;80;Трубопроводы и соединительные части;Труба полипропиленовая (PP-R)и соединительные части;ПК Контур;S;P2;24,73;53,2;;@;0
b0100010196;Труба PP-R белый Дн32х3,0 Ру10 40C L=4м ПК Контур 010100032000;120;Трубопроводы и соединительные части;Труба полипропиленовая (PP-R)и соединительные части;ПК Контур;S;P2;39,94;85,9;0105-00015;@;0
b0100024716;Тройник латунь переходн Дн26х3/4"х26 НР для мп Comap 9468786;2;Трубопроводы и соединительные части;Труба металлопластиковая (Pex-Al-Pex, Pex-Al-Pert )и соединительные части;Comap;Z;NL;410,71;448;0103-00236;&;0
b0100022802;Труба ПЭ80 черный SDR13,6 Дн25х2,0 Ру10 нап бухта 200м Политэк РЕ8W025020;38;Трубопроводы и соединительные части;Труба полиэтиленовая (ПЭ, ПНД) и соединительные части;Политэк;S;D2;23,49;33;0107-00433;@;0
b0100022803;Труба ПЭ80 черный SDR13,6 Дн32х2,4 Ру10 нап бухта 200м Политэк РЕ8W032024;280;Трубопроводы и соединительные части;Труба полиэтиленовая (ПЭ, ПНД) и соединительные части;Политэк;S;D2;34,88;51;0107-00434;@;0
b0100022804;Труба ПЭ80 черный SDR13,6 Дн40х3,0 Ру10 нап бухта 200м Политэк РЕ8W040030;187;Трубопроводы и соединительные части;Труба полиэтиленовая (ПЭ, ПНД) и соединительные части;Политэк;S;D0;54,6;79;0107-00435;@;0
b0100022823;Труба ПЭ80 черный SDR11 Дн20х2,0 Ру12,5 нап бухта 400м Политэк РЕ8W020020;836;Трубопроводы и соединительные части;Труба полиэтиленовая (ПЭ, ПНД) и соединительные части;Политэк;S;D0;18,21;26;0107-00454;@;0
b0100023086;Клапан предохранительный латунь Prescor B Rp1"xRp1 1/4" Ру16 ВР/ВР Рср8 АДЛ 5447;0;Регулирующая и предохр арматура и автоматика;Клапаны предохранительные;АДЛ;Z;D0;992,69;1 113,72;0404-00146;&;0
b0100023240;Соединитель латунь Дн20х3/4" ВР Valtec VTm.302.N.002005;1;Трубопроводы и соединительные части;Труба металлопластиковая (Pex-Al-Pex, Pex-Al-Pert )и соединительные части;Valtec;Z;D0;115,2;142;0103-01033;&;0
b0100023394;Водонагреватель эл накопительный 15л над раковиной 1,5кВт H 15-O Thermex;3;Котлы и водонагреватели;Водонагреватели;Thermex;Z;D0;4 763,81;6 317;0601-00200;&;0
b0100023512;Цилиндр минеральная вата  40/159 L=1м 650С желтый ROCKWOOL;10;Изоляция и уплотнение;Изоляция и термоизоляция;ROCKWOOL;Z;NL;496,31;658;1001-00679;&;0
b0100023532;Конструкция закладная ЗК14-2-6-02   отборное устройство давл.;7;Приборы учета и КИП;Термометры, манометры;_;Z;NL;461,99;518;;&;0
b0100023578;Муфта латунь Дн32х32 Valtec VTm.303.N.003232;1;Трубопроводы и соединительные части;Труба металлопластиковая (Pex-Al-Pex, Pex-Al-Pert )и соединительные части;Valtec;Z;NL;483,4;877;0103-01037;&;0
b0100023600;Воздухоотводчик Ду15 с отсеч/клап авт Icma 82.707.AD.05.710;50;Отопительное оборудование;Воздухоотводчики;Icma;S;D0;277,78;398;0504-00009;&;0
b0100023677;Винт-шуруп М8х90;434;Трубопроводы и соединительные части;Крепежные изделия;_;S;D0;2,89;4;0112-00674;@;0
b0100023841;Тройник латунь переходн Дн26х16х26 Faro пресс для мп STC 6516;91;Трубопроводы и соединительные части;Труба металлопластиковая (Pex-Al-Pex, Pex-Al-Pert )и соединительные части;STC;S;P2;158,31;284,96;0103-00058;@;0
b0100023845;Тройник латунь переходн Дн32х26х32 Faro пресс для мп STC 6516;1;Трубопроводы и соединительные части;Труба металлопластиковая (Pex-Al-Pex, Pex-Al-Pert )и соединительные части;STC;S;P2;248,7;431,01;0103-00402;@;0
b0100023879;Угольник ПНД компрессия  Дн20 Unidelta;5;Трубопроводы и соединительные части;Труба полиэтиленовая (ПЭ, ПНД) и соединительные части;Unidelta;Q;NL;51,33;77;0107-00660;&;0
b0100023882;Угольник ПНД компрессия  Дн25 Unidelta;2;Трубопроводы и соединительные части;Труба полиэтиленовая (ПЭ, ПНД) и соединительные части;Unidelta;Q;D0;57,22;87;0107-00663;&;0
b0100023884;Труба ПНД Дн20х2,0 Ру12,5;14;Трубопроводы и соединительные части;Труба полиэтиленовая (ПЭ, ПНД) и соединительные части;_;Q;D0;14,24;21;0107-00664;&;0
b0100023949;Муфта PP-R комбинированн под ключ белый Дн32х1" ВР ПК Контур 011216032300;108;Трубопроводы и соединительные части;Труба полипропиленовая (PP-R)и соединительные части;ПК Контур;S;P2;113,83;244,8;0105-01555;@;0
b0100024005;Кронштейн   формован.штыр/дюб обрезиненный КНР;8;Отопительное оборудование;Радиаторы;КНР;S;D2;40,4;66;0502-01716;&;0
b0100006467;Кольцо резина уплотнительн Дн315 ECOPAL КОРСИС;2;Водоотведение;Трубы для наружного водоотведения и соед части;КОРСИС;G;D0;121,55;143;0202-00241;&;0
b0100006804;Труба PE-X eval белый Дн25x2,3 Ру6 95C бухта 50м Uponor 1022689;50;Трубопроводы и соединительные части;Труба из сшитого полиэтилена (Pex)и соединительные части;Uponor;Z;D0;124,95;250,3;0104-00047;&;0
b0100006807;Кольцо PE-X белый Дн32 для труб Uponor 1057456;28;Трубопроводы и соединительные части;Труба из сшитого полиэтилена (Pex)и соединительные части;Uponor;S;P2;34,9;69,91;0104-00052;0;0
b0100006808;Кольцо PE-X белый Дн40 с упором Uponor 1045464;2;Трубопроводы и соединительные части;Труба из сшитого полиэтилена (Pex)и соединительные части;Uponor;Z;NL;43,48;58;0104-00234;&;0
b0100006810;Угольник PPSU Q&E Дн40х40 Uponor 1008683;3;Трубопроводы и соединительные части;Труба из сшитого полиэтилена (Pex)и соединительные части;Uponor;Z;NL;699,88;889;0104-00236;&;0
b0100006811;Угольник PPSU Дн32 для PE-X Uponor 1001245;4;Трубопроводы и соединительные части;Труба из сшитого полиэтилена (Pex)и соединительные части;Uponor;S;P2;330,47;662;0104-00063;0;0
b0100006823;Фиксатор  угл  для PE-X 14-16мм Uponor 1009004;10;Трубопроводы и соединительные части;Труба из сшитого полиэтилена (Pex)и соединительные части;Uponor;Z;D0;85,72;112;0104-00141;&;0
b0000000143;Теплоноситель Пропиленгликоль THERMAGENT-30 ЭКО 10кг канистра  THERMAGENT;5;Котлы и водонагреватели;Комплектующие и аксессуары для котлов;THERMAGENT;S;P2;938,1;1 326;0606-00101;0;0
b0000000144;Теплоноситель Пропиленгликоль THERMAGENT-30 ЭКО 20кг канистра  THERMAGENT;1;Котлы и водонагреватели;Комплектующие и аксессуары для котлов;THERMAGENT;S;P2;1 876,2;2 653;0606-00102;0;0
b0000000150;Нить уплотнительн УНИ-ЛОК 20м Tangit  ЭТ40;31;Изоляция и уплотнение;Уплотнительные материалы;Tangit;S;D0;187,84;304;1002-00225;&;0
b0000000170;Фильтр магнитн латунь ФМ-15Р Ду15 Ру16 ВР/ВР 120C ВЕНД;12;Регулирующая и предохр арматура и автоматика;Фильтры и грязевики;ВЕНД;S;P2;293,56;444;;0;0
b0100002843;Термопреобразователь КТПТР-05-70 L=70мм комплект- пара, кл.т.2,0;1;Приборы учета и КИП;Комплектующие для КИП;_;Z;D0;1 454,41;1 632;;&;0
b0100003025;Муфта PP-R Дн90х3" ВР под ключ;2;Трубопроводы и соединительные части;Труба полипропиленовая (PP-R)и соединительные части;_;Z;NL;1 483,84;1 665;0105-01107;&;0
b0100003226;Переходник PPSU Дн20х16 для PE-X Uponor 1008674;42;Трубопроводы и соединительные части;Труба из сшитого полиэтилена (Pex)и соединительные части;Uponor;S;P2;107,05;214,44;0104-00119;0;0
b0100003229;Кольцо PE-X белый Дн20 для труб Uponor 1057454;18;Трубопроводы и соединительные части;Труба из сшитого полиэтилена (Pex)и соединительные части;Uponor;S;P2;16,04;32,13;;0;0
b0100003230;Кольцо PE-X белый Дн25 для труб Uponor 1057455;2;Трубопроводы и соединительные части;Труба из сшитого полиэтилена (Pex)и соединительные части;Uponor;S;P2;21,71;43,49;0104-00054;0;0
b0100003234;Тройник PPSU Дн20х16х16 для PE-X Uponor 1008700;20;Трубопроводы и соединительные части;Труба из сшитого полиэтилена (Pex)и соединительные части;Uponor;S;P2;141,51;283,46;0104-00121;0;0
b0100003235;Тройник PPSU Дн25х16х25 для PE-X Uponor 1008690;20;Трубопроводы и соединительные части;Труба из сшитого полиэтилена (Pex)и соединительные части;Uponor;S;P2;239,53;479,83;0104-00122;0;0
b0100003237;Тройник PPSU Дн25 для PE-X Uponor 1008686;14;Трубопроводы и соединительные части;Труба из сшитого полиэтилена (Pex)и соединительные части;Uponor;S;P2;239,53;479,83;0104-00062;0;0
b0100003238;Переходник PPSU Дн25x16 для PE-X Uponor 1008675;10;Трубопроводы и соединительные части;Труба из сшитого полиэтилена (Pex)и соединительные части;Uponor;S;P2;141,91;284,28;0104-00083;0;0
b0100003239;Угольник PPSU Дн20 для PE-X Uponor 1008680;1;Трубопроводы и соединительные части;Труба из сшитого полиэтилена (Pex)и соединительные части;Uponor;S;P2;113,21;226,78;0104-00185;0;0
b0100003241;Угольник PPSU Дн16 для PE-X Uponor 1008679;9;Трубопроводы и соединительные части;Труба из сшитого полиэтилена (Pex)и соединительные части;Uponor;S;P2;89,82;179,93;0104-00184;0;0
b0100003248;Штуцер латунь Дн20х3/4" для PE-X НР Uponor 1033438;6;Трубопроводы и соединительные части;Труба из сшитого полиэтилена (Pex)и соединительные части;Uponor;S;P2;186,2;373,01;0104-00067;0;0
b0100003223;Шланг заливной для стиральной машины L=4м х/в ЗИП 018-0039;6;Сантехника;Комплектующие и аксессуары к сантехнике;ЗИП;S;P2;100,26;174;0908-00092;&;0
b0100003266;Тройник PP-R Дн75 ПК Контур 011501075000;41;Трубопроводы и соединительные части;Труба полипропиленовая (PP-R)и соединительные части;ПК Контур;S;P2;131,88;283,6;0105-01108;&;0
b0100003328;Задвижка аналог МЗВГ VOC4241 чугун Ду65 Ру16 130С Tecofi;2;Запорная арматура;Задвижки;Tecofi;S;P2;3 655,41;5 933,33;0302-00105;0;0
b0100003333;Смеситель для мойки пластик р/затвор б/подводки пл/маховик КСМ-53 Казань 19755(102001);46;Сантехника;Смесители и краны для сан.узлов;Казань;S;D0;551,76;800;0909-00465;@;0
b0100002417;Переход PP-H серый Дн50 б/нап на чугун Ostendorf;0;Водоотведение;Трубы для внутреннего водоотведения и соед части;Ostendorf;Z;D0;31,16;36;0201-00001;&;0
b0100002512;Муфта PP-R Дн110 ПК Контур 011201110000;43;Трубопроводы и соединительные части;Труба полипропиленовая (PP-R)и соединительные части;ПК Контур;S;P2;156,47;336,5;0105-01101;@;0
b0100002513;Муфта PP-R переходн Дн90х63  011203090610;2;Трубопроводы и соединительные части;Труба полипропиленовая (PP-R)и соединительные части;_;S;D2;116,86;251,3;0105-01102;@;0
b0100002562;Тройник PP-R переходн белый Дн75х63х75 ПК Контур 011503075910;13;Трубопроводы и соединительные части;Труба полипропиленовая (PP-R)и соединительные части;ПК Контур;S;P2;228,73;491,9;0105-00754;&;0
b0100002569;Насос циркуляционный Star-RS 30/8 в комплекте Wilo 4182642;1;Насосное оборудование;Насосы и насосные установки;Wilo;S;P2;4 831,01;9 281,01;0801-00035;@;0
b0100002582;Труба PP-R белый Дн110х18,3 Ру20 80C L=4м ПК Контур 010200110000;72;Трубопроводы и соединительные части;Труба полипропиленовая (PP-R)и соединительные части;ПК Контур;S;P2;791,85;1 702,9;0105-00796;&;0
b0100002584;Угольник PP-R белый Дн110 ПК Контур 011401110000;26;Трубопроводы и соединительные части;Труба полипропиленовая (PP-R)и соединительные части;ПК Контур;S;D0;291,19;626,2;0105-01103;@;0
b0100002586;Бурт PP-R с фланцем Дн110 ПК Контур 011320110000;26;Трубопроводы и соединительные части;Труба полипропиленовая (PP-R)и соединительные части;ПК Контур;S;P2;371,35;798,6;0105-01105;@;0
b0100026909;Отвод PP-H Дн110х15° Политэк;20;Водоотведение;Трубы для внутреннего водоотведения и соед части;Политэк;S;D0;39,98;64;0201-00580;&;0
b0100027015;Нить уплотнительн в блистере 50м Рекорд  04002;15;Изоляция и уплотнение;Уплотнительные материалы;Рекорд;S;P2;104,43;176;1002-00253;0;0
b0100027146;Сифон верт выпуск HL 138 Ду32 для кондиционеров HL138;1;Вентиляционное оборудование;Комплектующие и аксессуары для вентиляции;HL;Z;NL;1 274,75;1 690;1502-00017;&;0
b0100027251;Отвод PP-H Дн50х15° Политэк;9;Водоотведение;Трубы для внутреннего водоотведения и соед части;Политэк;S;D2;14,87;24;0201-00582;&;0
b0100027252;Патрубок PP-H компенсационн Ду50 Политэк;85;Водоотведение;Трубы для внутреннего водоотведения и соед части;Политэк;S;P2;26;52;0201-00583;&;0
b0100027253;Ревизия PP-H Дн50 Политэк;40;Водоотведение;Трубы для внутреннего водоотведения и соед части;Политэк;S;D0;41,52;66;0201-00584;&;0
b0100027324;Опора   для душевого поддона 800х800мм;16;Сантехника;Кабины душевые, поддоны;_;S;P2;548,36;825;0907-00033;&;0
b0100027509;Биде  Альфана белый 1 отверстие б/комплекта Оскол;6;Сантехника;Биде;Оскол;S;D0;1 478,12;2 164;0905-00004;&;0
b0100027533;Болт М22х70;36;Трубопроводы и соединительные части;Крепежные изделия;_;Z;NL;67,7;75;0112-00759;&;0
b0100027534;Болт М24х70;50;Трубопроводы и соединительные части;Крепежные изделия;_;Z;NL;67,58;75;0112-00760;&;0
b0100027841;Сифон для умывальника/мойки 1 1/2"х40/50 бутылочный с гофрой нерж/сетка АНИ A0115;13;Сантехника;Комплектующие и аксессуары к сантехнике;АНИ;S;D2;103,84;157;0908-00042;@;0
b0100027848;Кран шаровой BASE латунь VT.219 Ду1" НР/НР бабочка Valtec VT.219.N.06;13;Запорная арматура;Краны;Valtec;Z;NL;390,05;650;0301-01987;&;0
b0100027863;Угольник латунь Ду1" ВР/ВР Valtec VTr.090.N.0006;9;Трубопроводы и соединительные части;Латунные и чугунные соединительные части трубопроводов;Valtec;Z;NL;195,12;354;0111-01261;&;0
b0100027867;Сгон латунь угл Ду3/4" ВР/НР американка Valtec VTr.098.N.0005;7;Трубопроводы и соединительные части;Латунные и чугунные соединительные части трубопроводов;Valtec;Z;NL;171,42;311;0111-01265;&;0
b0100027875;Сгон латунь прям никель Ду1 1/4" ВР/НР Valtec VTr.341.N.0007;6;Трубопроводы и соединительные части;Латунные и чугунные соединительные части трубопроводов;Valtec;Z;NL;386,39;701;0111-01273;&;0
b0100027924;Сгон латунь прям никель Ду1 1/2" ВР/НР Valtec VTr.341.N.0008;8;Трубопроводы и соединительные части;Латунные и чугунные соединительные части трубопроводов;Valtec;Z;NL;542,38;984;0111-01277;&;0
b0100027957;Полотенцесушитель сталь нерж М-образный 500х400 1";5;Сантехника;Полотенцесушители;_;S;Pz;709,99;1 029;0911-00238;&;0
b0100028057;Угольник латунь Q&E Дн25х3/4" НР Uponor 1023022;18;Трубопроводы и соединительные части;Труба из сшитого полиэтилена (Pex)и соединительные части;Uponor;Z;NL;408,35;520;0104-00247;&;0
b0100028129;Регулятор давления 143 ХВС и ГВС Ду15 ВР/ВР STC 022-0227;2;Регулирующая и предохр арматура и автоматика;Регуляторы давления и температуры;STC;S;P2;696,05;977,44;0402-00003;@;0
b0100028204;Переход чугун/пластик резина 120х110 Снежинск;286;Изоляция и уплотнение;Уплотнительные материалы;Снежинск;S;D0;47,32;71;0908-00454;&;0
b0100028206;Переход чугун/пластик резина 70х50 Снежинск;116;Изоляция и уплотнение;Уплотнительные материалы;Снежинск;S;D0;35,2;53;0908-00455;&;0
