00000001858;Муфта PP-R усиленн комбинированн разъемн Дн20х1/2" ВР ПК Контур 011304020100;341;Трубопроводы и соединительные части;Труба полипропиленовая (PP-R)и соединительные части;ПК Контур;S;D0;86,54;186,1;0105-01306;@;0
00000001859;Муфта PP-R усиленн комбинированн разъемн Дн25х3/4" ВР ПК Контур 011304025200;677;Трубопроводы и соединительные части;Труба полипропиленовая (PP-R)и соединительные части;ПК Контур;S;D0;125,32;269,5;0105-01307;@;0
00000001860;Муфта PP-R усиленн комбинированн разъемн Дн20х1/2" НР ПК Контур 011301020100;674;Трубопроводы и соединительные части;Труба полипропиленовая (PP-R)и соединительные части;ПК Контур;S;D0;101,42;218,1;0105-01308;@;0
00000001861;Муфта PP-R усиленн комбинированн разъемн Дн20x3/4" НР ПК Контур 011301020200;165;Трубопроводы и соединительные части;Труба полипропиленовая (PP-R)и соединительные части;ПК Контур;S;D0;111,7;240,2;0105-01309;@;0
00000001862;Муфта PP-R усиленн комбинированн разъемн Дн25x3/4" НР ПК Контур 011301025200;341;Трубопроводы и соединительные части;Труба полипропиленовая (PP-R)и соединительные части;ПК Контур;S;D2;139,26;299,5;0105-01310;@;0
00000001864;Пробка PP-R Дн20 ПК Контур 011606020000;774;Трубопроводы и соединительные части;Труба полипропиленовая (PP-R)и соединительные части;ПК Контур;S;P2;2,7;5,8;0105-01311;@;0
00000001872;Кран шаровой латунь Idro Ду15 ВР/ВР полный проход рычаг STC 1501;56;Запорная арматура;Краны;STC;S;D0;130,26;188,88;0301-00174;@;0
00000001874;Кран шаровой латунь Idro Ду25 ВР/ВР полный проход рычаг STC 1501;10;Запорная арматура;Краны;STC;S;D0;290,91;422,26;0301-00176;@;0
00000001875;Кран шаровой латунь Idro Ду32 ВР/ВР полный проход рычаг STC 1501;6;Запорная арматура;Краны;STC;S;D0;458,08;665,41;0301-00177;@;0
00000001876;Кран шаровой латунь Idro Ду40 ВР/ВР полный проход рычаг STC 1501;14;Запорная арматура;Краны;STC;S;P2;655,64;953,07;0301-00178;@;0
00000001877;Кран шаровой латунь Idro Ду50 ВР/ВР полный проход рычаг STC 1501;6;Запорная арматура;Краны;STC;S;D1;1 024,71;1 488,22;0301-00179;@;0
00000001881;Кран шаровой латунь Idro Ду15 ВР/ВР полный проход бабочка STC 1502;25;Запорная арматура;Краны;STC;S;D0;128,63;187,25;0301-00186;@;0
00000001882;Кран шаровой латунь Idro Ду20 ВР/ВР полный проход бабочка STC 1502;127;Запорная арматура;Краны;STC;S;D0;186,16;270,29;0301-00187;@;0
00000001883;Кран шаровой латунь Idro Ду25 ВР/ВР полный проход бабочка STC 1502;28;Запорная арматура;Краны;STC;S;Pz;288,2;418,46;0301-00188;@;0
00000001884;Кран шаровой латунь Idro Ду15 ВР/НР полный проход рычаг STC 1503;20;Запорная арматура;Краны;STC;S;D0;136,23;207,33;0301-00195;@;0
00000001885;Кран шаровой латунь Idro Ду20 ВР/НР полный проход рычаг STC 1503;16;Запорная арматура;Краны;STC;S;D0;198,1;300,14;0301-00196;@;0
00000001886;Кран шаровой латунь Idro Ду25 ВР/НР полный проход рычаг STC 1503;41;Запорная арматура;Краны;STC;S;P2;309,37;449,4;0301-00197;&;0
00000001887;Кран шаровой латунь Idro Ду32 ВР/НР полный проход рычаг STC 1503;8;Запорная арматура;Краны;STC;S;D0;502,59;730,54;0301-00198;@;0
00000001888;Кран шаровой латунь Idro Ду40 ВР/НР полный проход рычаг STC 1503;6;Запорная арматура;Краны;STC;S;D0;678,44;1 028,51;0301-00199;@;0
00000001889;Кран шаровой латунь Idro Ду50 ВР/НР полный проход рычаг STC 1503;10;Запорная арматура;Краны;STC;S;P2;1 046,42;1 586,46;0301-00200;@;0
00000001892;Кран шаровой латунь Idro Ду20 ВР/НР полный проход бабочка STC 1504;120;Запорная арматура;Краны;STC;S;P2;204,07;296,34;0301-00172;@;0
00000001893;Кран шаровой латунь Idro Ду25 ВР/НР полный проход бабочка STC 1504;24;Запорная арматура;Краны;STC;S;P2;299,6;446,14;0301-00173;&;0
00000001894;Кран шаровой латунь Idro Ду15 НР/нак.г бабочка STC 1508;61;Запорная арматура;Краны;STC;S;Pz;185,08;268,66;0301-00201;@;0
00000001895;Кран шаровой латунь Idro Ду20 НР/нак.г бабочка STC 1508;31;Запорная арматура;Краны;STC;S;D0;270,83;393,49;0301-00202;@;0
00000001896;Кран шаровой латунь Idro Ду25 НР/нак.г бабочка STC 1508;18;Запорная арматура;Краны;STC;S;D0;422,8;613,31;0301-00203;@;0
00000001897;Кран шаровой латунь Idro Ду32 НР/нак.г бабочка STC 1508;9;Запорная арматура;Краны;STC;S;D0;639,36;929,73;0301-00204;@;0
00000001910;Муфта PP-R комбинированн Дн20х3/4" ВР ПК Контур 011212020200;247;Трубопроводы и соединительные части;Труба полипропиленовая (PP-R)и соединительные части;ПК Контур;S;D0;37,85;81,4;0105-01312;@;0
00000001912;Муфта PP-R комбинированн Дн25х1" ВР ПК Контур 011212025300;220;Трубопроводы и соединительные части;Труба полипропиленовая (PP-R)и соединительные части;ПК Контур;S;D0;80,07;172,2;0105-01314;@;0
00000001913;Муфта PP-R комбинированн Дн25х1/2" ВР ПК Контур 011212025100;159;Трубопроводы и соединительные части;Труба полипропиленовая (PP-R)и соединительные части;ПК Контур;S;D0;27,9;60;0105-00673;@;0
00000001915;Муфта PP-R усиленн комбинированн разъемн Дн25x3/4" ВР трубная ПК Контур 011308025200;1;Трубопроводы и соединительные части;Труба полипропиленовая (PP-R)и соединительные части;ПК Контур;Z;D0;126,06;141;0105-00982;&;0
00000001916;Муфта PP-R комбинированн Дн20х3/4" НР ПК Контур 011211020200;290;Трубопроводы и соединительные части;Труба полипропиленовая (PP-R)и соединительные части;ПК Контур;S;D0;48,26;103,8;0105-00983;@;0
00000001918;Муфта PP-R комбинированн Дн25х1" НР ПК Контур 011211025300;182;Трубопроводы и соединительные части;Труба полипропиленовая (PP-R)и соединительные части;ПК Контур;S;D0;97,93;210,6;0105-00985;@;0
00000001919;Муфта PP-R усиленн комбинированн разъемн Дн20х1" НР ПК Контур 011301020300;31;Трубопроводы и соединительные части;Труба полипропиленовая (PP-R)и соединительные части;ПК Контур;S;P2;168,47;362,3;0105-00986;@;0
00000001920;Уплотнитель для смесителей набор Симтек 43 шт;10;Сантехника;Комплектующие и аксессуары к сантехнике;Симтек;S;D1;28,63;49;0908-00333;@;0
00000001931;Отвод сталь крутоизогнутый Дн57х5,0 ГОСТ 17375-2001 ПЗКТ;22;Трубопроводы и соединительные части;Труба стальная и соединительные части;ПЗКТ;S;P2;75;117;0101-01121;0;0
00000001932;Муфта PP-R усиленн комбинированн разъемн Дн25х1/2" НР трубная;2;Трубопроводы и соединительные части;Труба полипропиленовая (PP-R)и соединительные части;_;S;D2;122,99;189;0105-00987;@;0
00000001933;Отвод сталь крутоизогнутый Дн76х6,0 ГОСТ 17375-2001 ПЗКТ;2;Трубопроводы и соединительные части;Труба стальная и соединительные части;ПЗКТ;S;P2;138;217;0101-01122;0;0
00000001944;Радиатор чугун МС-140М2-500 7 секций НТКРЗ;11;Отопительное оборудование;Радиаторы;НТКРЗ;S;D2;2 557,79;3 749;0502-00973;@;0
00000001955;Аппарат сварочный Дн20,25,32,40  в комплекте сменные нагреватели;8;Инструмент и сварочное оборудование;Инструмент и сопутствующие товары;_;S;D1;2 628,62;3 717;1201-00030;&;0
00000001961;Кран для писсуара латунь 1/2" р/затвор  Санлит-Т;5;Сантехника;Смесители и краны для сан.узлов;Санлит-Т;S;D0;167,96;292;0909-00544;&;0
00000001962;Сифон для писсуара настенного Дельта;6;Сантехника;Комплектующие и аксессуары к сантехнике;_;S;D0;53,49;93;0908-00259;@;0
00000001983;Подводка гибкая  M10-H1/2" L=0,3м STC 6070;30;Сантехника;Подводка гибкая;STC;S;P2;31,71;66,39;0912-00069;@;0
00000001984;Подводка гибкая  M10-H1/2" L=0,4м STC 6070;0;Сантехника;Подводка гибкая;STC;S;D2;50,02;72,01;0912-00070;@;0
00000001987;Подводка гибкая  M10-H1/2" L=0,8м STC 6070;123;Сантехника;Подводка гибкая;STC;S;D0;79,26;118;0912-00073;@;0
00000001991;Вентиль PP-R Дн20 ПК Контур 011121020000;102;Трубопроводы и соединительные части;Труба полипропиленовая (PP-R)и соединительные части;ПК Контур;S;P2;120,16;258,4;0105-00039;@;0
00000001992;Вентиль PP-R Дн25 ПК Контур 011121025000;32;Трубопроводы и соединительные части;Труба полипропиленовая (PP-R)и соединительные части;ПК Контур;S;D0;152,8;328,6;0105-00040;@;0
00000001993;Вентиль PP-R Дн32 ПК Контур 011121032000;27;Трубопроводы и соединительные части;Труба полипропиленовая (PP-R)и соединительные части;ПК Контур;S;P2;265,33;570,6;0105-00041;@;0
00000001995;Трап горизонт 110мм с пл/решеткой Viega 12095;1;Водоотведение;Трапы, колодцы, воронки;Viega;S;P2;550,13;778;0204-00070;0;0
00000002011;Арматура для бачка  бок/подвод кнопка универсал Уклад АБ 68.03.14.0;39;Сантехника;Унитазы;Уклад;S;P2;157,47;249;0902-00103;@;0
00000002012;Арматура для бачка  кнопка хром бок/подвод универсал Уклад АБ 68.03.14.3;22;Сантехника;Унитазы;Уклад;S;D0;165,9;263;0902-00104;@;0
00000002013;Арматура для бачка  ниж/подвод кнопка универсал Уклад АБ69.03.14.0;22;Сантехника;Унитазы;Уклад;S;D0;163,05;259;0902-00105;&;0
00000002014;Арматура для бачка  кнопка хром ниж/подвод универсал Уклад АБ69.03.14.3;87;Сантехника;Унитазы;Уклад;S;P2;171,48;272;0902-00106;@;0
00000002023;Затвор дисковый поворотный VPN3448-0203 Ду65 Ру16 межфл EPDM Tecofi;6;Запорная арматура;Затворы;Tecofi;S;D0;1 359,04;2 206,27;0303-00020;@;0
00000002030;Клапан обратный чугун CB3440/CB3448 Ду100 Ру16 межфл двухстворчатый Tecofi;0;Регулирующая и предохр арматура и автоматика;Затворы, клапаны обратные;Tecofi;S;D2;2 323,51;3 771,56;0405-00195;0;0
00000002038;Компенсатор Dl7240 Ду80 Ру10 фл Tecofi;2;Трубопроводы и соединительные части;Компенсаторы;Tecofi;S;P2;1 814,41;2 944,41;0113-00013;&;0
00000002053;Клапан обратный сталь CB5440 Ду150 Ру16 межфл 1/створ Tecofi;3;Регулирующая и предохр арматура и автоматика;Затворы, клапаны обратные;Tecofi;S;P2;2 686,06;4 479,31;0405-00180;0;0
00000002080;Клапан латунь  шаровый Аркон А-55;71;Сантехника;Унитазы;Аркон;S;P2;107,21;170;0902-00455;@;0
00000002081;Колонка сливная латунь  Аркон А-65;8;Сантехника;Унитазы;Аркон;S;P2;81,5;174;0902-00456;@;0
00000002085;Опора PP-R двойн Дн25;1;Трубопроводы и соединительные части;Труба полипропиленовая (PP-R)и соединительные части;_;Z;NL;4,01;7;0105-00991;&;0
00000002104;Манжета  Дн110 эксцентрическая АНИ W0420;28;Сантехника;Комплектующие и аксессуары к сантехнике;АНИ;S;P2;46,98;73;0908-00146;@;0
00000002133;Муфта латунь переходн никель Ду3/4"х1" ВР/ВР General Fittings;20;Трубопроводы и соединительные части;Латунные и чугунные соединительные части трубопроводов;General Fittings;S;P2;98,24;145,46;0111-01025;0;0
00000002136;Тройник латунь никель Ду1/2" ВР General Fittings;21;Трубопроводы и соединительные части;Латунные и чугунные соединительные части трубопроводов;General Fittings;S;P2;79,24;117,78;0111-01027;0;0
00000002144;Угольник латунь никель Ду1/2" ВР/НР General Fittings;8;Трубопроводы и соединительные части;Латунные и чугунные соединительные части трубопроводов;General Fittings;S;P2;75,97;112;0111-01035;0;0
00000002155;Труба PP-R белый Дн32х5,4 Ру20 80C L=4м ПК Контур 010200032000;1 656;Трубопроводы и соединительные части;Труба полипропиленовая (PP-R)и соединительные части;ПК Контур;S;D0;55,06;118,4;0105-00019;@;0
00000002156;Опора PP-R Дн32 ПК Контур 011609032000;1 260;Трубопроводы и соединительные части;Труба полипропиленовая (PP-R)и соединительные части;ПК Контур;S;D0;2,42;5,2;0105-00992;@;0
00000002157;Муфта PP-R Дн32 ПК Контур 011201032000;1 616;Трубопроводы и соединительные части;Труба полипропиленовая (PP-R)и соединительные части;ПК Контур;S;D0;5,44;11,7;0105-00993;@;0
00000002158;Угольник PP-R белый Дн32 ПК Контур 011401032000;1 697;Трубопроводы и соединительные части;Труба полипропиленовая (PP-R)и соединительные части;ПК Контур;S;D0;8,51;18,3;0105-00994;@;0
00000002159;Тройник PP-R Дн32 ПК Контур 011501032000;616;Трубопроводы и соединительные части;Труба полипропиленовая (PP-R)и соединительные части;ПК Контур;S;P2;12,97;27,9;0105-00995;@;0
00000002175;Труба PP-R белый Дн40х6,7 Ру20 80C L=4м ПК Контур 010200040000;604;Трубопроводы и соединительные части;Труба полипропиленовая (PP-R)и соединительные части;ПК Контур;S;D0;90,72;195,1;0105-00020;@;0
00000002176;Труба PP-R белый Дн50х8,3 Ру20 80C L=4м ПК Контур 010200050000;964;Трубопроводы и соединительные части;Труба полипропиленовая (PP-R)и соединительные части;ПК Контур;S;P2;143,87;309,4;0105-00021;@;0
00000002177;Муфта PP-R переходн Дн32х20 ПК Контур 011203032100;639;Трубопроводы и соединительные части;Труба полипропиленовая (PP-R)и соединительные части;ПК Контур;S;P2;4,28;9,2;0105-00999;@;0
00000002178;Муфта PP-R переходн Дн32х25 ПК Контур 011203032200;227;Трубопроводы и соединительные части;Труба полипропиленовая (PP-R)и соединительные части;ПК Контур;S;D1;4,79;10,3;0105-01000;@;0
00000002179;Муфта PP-R переходн белый Дн40х20 ПК Контур 011203040100;506;Трубопроводы и соединительные части;Труба полипропиленовая (PP-R)и соединительные части;ПК Контур;S;P2;7,12;15,3;0105-00658;@;0
00000002180;Муфта PP-R переходн белый Дн40х25 ПК Контур 011203040200;300;Трубопроводы и соединительные части;Труба полипропиленовая (PP-R)и соединительные части;ПК Контур;S;D0;7,16;15,4;0105-00659;@;0
00000002181;Муфта PP-R переходн белый Дн40х32 ПК Контур 011203040300;212;Трубопроводы и соединительные части;Труба полипропиленовая (PP-R)и соединительные части;ПК Контур;S;D0;8,7;18,7;0105-00660;@;0
00000002182;Муфта PP-R переходн белый Дн50х20 ПК Контур 011203050100;105;Трубопроводы и соединительные части;Труба полипропиленовая (PP-R)и соединительные части;ПК Контур;S;P2;13,3;28,6;0105-00661;&;0
00000002184;Муфта PP-R переходн белый Дн50х32 ПК Контур 011203050300;377;Трубопроводы и соединительные части;Труба полипропиленовая (PP-R)и соединительные части;ПК Контур;S;P2;13,58;29,2;0105-00662;@;0
00000002185;Муфта PP-R переходн белый Дн50х40 ПК Контур 011203050400;314;Трубопроводы и соединительные части;Труба полипропиленовая (PP-R)и соединительные части;ПК Контур;S;P2;14,69;31,6;0105-00663;@;0
00000002186;Тройник PP-R переходн Дн32х20х20  011503032100;4;Трубопроводы и соединительные части;Труба полипропиленовая (PP-R)и соединительные части;_;S;P2;10,21;18,3;0105-01001;0;0
00000002187;Тройник PP-R переходн Дн32х20х32 ПК Контур 011503032300;739;Трубопроводы и соединительные части;Труба полипропиленовая (PP-R)и соединительные части;ПК Контур;S;D0;10,09;21,7;0105-00702;@;0
00000002188;Тройник PP-R переходн Дн32х25х32 ПК Контур 011503032600;520;Трубопроводы и соединительные части;Труба полипропиленовая (PP-R)и соединительные части;ПК Контур;S;D0;10,56;22,7;0105-00703;@;0
00000002189;Тройник PP-R переходн Дн40х20х40 ПК Контур 011503040200;391;Трубопроводы и соединительные части;Труба полипропиленовая (PP-R)и соединительные части;ПК Контур;S;D0;17,25;37,1;0105-00704;@;0
00000002190;Тройник PP-R переходн Дн40х25х40 ПК Контур 011503040400;558;Трубопроводы и соединительные части;Труба полипропиленовая (PP-R)и соединительные части;ПК Контур;S;D0;19,34;41,6;0105-00705;@;0
00000002191;Тройник PP-R переходн Дн40х32х40 ПК Контур 011503040600;388;Трубопроводы и соединительные части;Труба полипропиленовая (PP-R)и соединительные части;ПК Контур;S;D0;19,43;41,8;0105-00706;@;0
00000002192;Тройник PP-R переходн Дн50х25х50 ПК Контур 011503050400;301;Трубопроводы и соединительные части;Труба полипропиленовая (PP-R)и соединительные части;ПК Контур;S;D0;37,02;79,6;0105-01002;@;0
00000002193;Тройник PP-R переходн Дн50х32х50 ПК Контур 011503050600;365;Трубопроводы и соединительные части;Труба полипропиленовая (PP-R)и соединительные части;ПК Контур;S;P2;37,81;81,3;0105-01003;@;0
00000002194;Тройник PP-R переходн Дн50х40х50 ПК Контур 011503050800;204;Трубопроводы и соединительные части;Труба полипропиленовая (PP-R)и соединительные части;ПК Контур;S;P2;40,27;86,6;0105-01004;@;0
00000002195;Угольник PP-R белый Дн40 ПК Контур 011401040000;751;Трубопроводы и соединительные части;Труба полипропиленовая (PP-R)и соединительные части;ПК Контур;S;D0;15,39;33,1;0105-01005;@;0
00000002196;Угольник PP-R белый Дн50 ПК Контур 011401050000;280;Трубопроводы и соединительные части;Труба полипропиленовая (PP-R)и соединительные части;ПК Контур;S;D0;28,32;60,9;0105-00685;@;0
00000002197;Муфта PP-R Дн40 ПК Контур 011201040000;525;Трубопроводы и соединительные части;Труба полипропиленовая (PP-R)и соединительные части;ПК Контур;S;D0;8,51;18,3;0105-01006;@;0
00000002198;Муфта PP-R Дн50 ПК Контур 011201050000;306;Трубопроводы и соединительные части;Труба полипропиленовая (PP-R)и соединительные части;ПК Контур;S;D0;16,84;36,2;0105-01007;@;0
00000002199;Опора PP-R Дн40  011609040000;447;Трубопроводы и соединительные части;Труба полипропиленовая (PP-R)и соединительные части;_;S;D0;3,74;8;0105-01008;@;0
00000002200;Опора PP-R Дн50 с защелкой  011609050010;344;Трубопроводы и соединительные части;Труба полипропиленовая (PP-R)и соединительные части;_;S;D0;7,16;18;0105-01009;@;0
00000002208;Умывальник хирургический белый б/отверстия б/комплекта Киров;1;Сантехника;Умывальники;Киров;Z;NL;2 026,3;2 211;0903-00053;&;0
00000002211;Угольник PP-R комбинированн белый Дн25х1/2" ВР ПК Контур 011414025100;162;Трубопроводы и соединительные части;Труба полипропиленовая (PP-R)и соединительные части;ПК Контур;S;P2;30,69;66;0105-00732;@;0
00000002212;Угольник PP-R комбинированн белый Дн32х1" ВР ПК Контур 011414032300;45;Трубопроводы и соединительные части;Труба полипропиленовая (PP-R)и соединительные части;ПК Контур;S;P2;87,6;188,4;0105-00733;@;0
00000002213;Угольник PP-R комбинированн белый Дн32х1" НР ПК Контур 011411032300;9;Трубопроводы и соединительные части;Труба полипропиленовая (PP-R)и соединительные части;ПК Контур;S;P2;95,6;205,6;0105-00695;@;0
00000002214;Тройник PP-R комбинированн белый Дн20х3/4" ВР ПК Контур 011512020200;70;Трубопроводы и соединительные части;Труба полипропиленовая (PP-R)и соединительные части;ПК Контур;S;P2;48,26;103,8;0105-00711;@;0
