b0100009747;Ниппель для радиатора Ogint сталь кадмированная  Ду25 Ogint;89;Отопительное оборудование;Радиаторы;Ogint;S;D0;8,68;14,3;0502-00031;@;0
b0100009766;Чаша чугун Генуя напольн эмаль белый б/комплекта;1;Сантехника;Унитазы;_;Z;D0;1 985;2 633;0902-00310;&;0
b0100009801;Кран шаровой латунь 11б27п1 Ду20 ВР/ВР СТП 11Б27п1;4;Запорная арматура;Краны;СТП;Q;D0;83,96;168;0301-01710;&;0
b0100009802;Кран шаровой латунь 11б27п1 Ду32 ВР/ВР СТП 11Б27п1;9;Запорная арматура;Краны;СТП;Q;D0;232,47;254;0301-01711;&;0
b0100009803;Кран шаровой латунь 11б27п1 Ду40 ВР/ВР СТП 11Б27п1;1;Запорная арматура;Краны;СТП;Q;D0;346,12;377;0301-01712;&;0
b0100009819;Набор резина №5 прокладка;15;Изоляция и уплотнение;Уплотнительные материалы;_;S;D0;15,84;26;1002-00052;&;0
b0100009821;Набор резина №8 прокладка;10;Изоляция и уплотнение;Уплотнительные материалы;_;S;D0;19,79;32;1002-00053;&;0
b0100009822;Набор резина №10 прокладка;0;Изоляция и уплотнение;Уплотнительные материалы;_;S;D2;19,4;33;1002-00054;&;0
b0100009871;Воздухоотводчик Ду25 авт лев Icma 82.716.AT.06    019-0295;2;Отопительное оборудование;Воздухоотводчики;Icma;Z;D0;174,43;191;0504-00020;&;0
b0100009888;Комплект сварочный PROFF-Z 110 ПК Контур 1200Вт 75-110мм с цифр.индикатором  012202075910;2;Инструмент и сварочное оборудование;Инструмент и сопутствующие товары;ПК Контур;Z;D0;5 314,3;11 428,6;1201-01063;&;0
b0100010007;Дрель-шуруповерт 6261 Makita 9,6Вт  ЖЛ96;1;Инструмент и сварочное оборудование;Инструмент и сопутствующие товары;Makita;Z;D0;5 524,88;6 199;;&;0
b0100010033;Угольник PP-R комбинированн белый Дн32х3/4" НР ПК Контур 011411032200;10;Трубопроводы и соединительные части;Труба полипропиленовая (PP-R)и соединительные части;ПК Контур;Q;D0;72,36;155,6;0105-00693;&;0
b0100008464;Труба PP-RGF арм стекловолокном белый Дн20х3,4 Ру25 80C L=4м ПК Контур 010220020000;3 648;Трубопроводы и соединительные части;Труба полипропиленовая (PP-R)и соединительные части;ПК Контур;S;D0;26,1;60,7;0105-00640;@;0
b0100008465;Труба PP-RGF арм стекловолокном белый Дн25х4,2 Ру25 80C L=4м ПК Контур 010220025000;3 836;Трубопроводы и соединительные части;Труба полипропиленовая (PP-R)и соединительные части;ПК Контур;S;D0;41,37;96,2;0105-00641;@;0
b0100008466;Труба PP-RGF арм стекловолокном белый Дн32х5,4 Ру25 80C L=4м ПК Контур 010220032000;1 344;Трубопроводы и соединительные части;Труба полипропиленовая (PP-R)и соединительные части;ПК Контур;S;D0;69,02;160,5;0105-00642;@;0
b0100008483;Ванна чугун 1500х700мм Ресса Silver белый б/сифона Киров;14;Сантехника;Ванны;Киров;S;Pz;7 692,74;10 878;0901-00006;@;0
b0100008512;Соединитель латунь Дн16х1/2" пресс ВР Valtec VTm.202.N.001604;1;Трубопроводы и соединительные части;Труба металлопластиковая (Pex-Al-Pex, Pex-Al-Pert )и соединительные части;Valtec;Q;D0;65,94;110;0103-00947;&;0
b0100008515;Муфта латунь Дн26х26 пресс Valtec VTm.203.N.002626;1;Трубопроводы и соединительные части;Труба металлопластиковая (Pex-Al-Pex, Pex-Al-Pert )и соединительные части;Valtec;Q;NL;157,09;285;0103-00949;&;0
b0100008517;Тройник латунь переходн Дн20х20х16 пресс Valtec VTm.231.N.202016;31;Трубопроводы и соединительные части;Труба металлопластиковая (Pex-Al-Pex, Pex-Al-Pert )и соединительные части;Valtec;Q;D0;218,19;377;0103-00951;&;0
b0100008520;Угольник латунь Дн16х1/2" пресс ВР Valtec VTm.252.N.001604;2;Трубопроводы и соединительные части;Труба металлопластиковая (Pex-Al-Pex, Pex-Al-Pert )и соединительные части;Valtec;Q;NL;87,97;152;0103-00954;&;0
b0100008521;Угольник латунь Дн20х3/4" пресс ВР Valtec VTm.252.N.002005;6;Трубопроводы и соединительные части;Труба металлопластиковая (Pex-Al-Pex, Pex-Al-Pert )и соединительные части;Valtec;Q;NL;138,9;170;0103-00955;&;0
b0100008522;Угольник латунь Дн16х1/2" пресс НР Valtec VTm.253.N.001604;21;Трубопроводы и соединительные части;Труба металлопластиковая (Pex-Al-Pex, Pex-Al-Pert )и соединительные части;Valtec;Q;NL;83,66;145;0103-00956;&;0
b0100008523;Угольник латунь Дн20х3/4" пресс НР Valtec VTm.253.N.002005;9;Трубопроводы и соединительные части;Труба металлопластиковая (Pex-Al-Pex, Pex-Al-Pert )и соединительные части;Valtec;Q;NL;138,06;233;0103-00957;&;0
mt000000151;Тройник латунь переходн Дн26х26х20 пресс для мп Comap 733JJE;4;Трубопроводы и соединительные части;Труба металлопластиковая (Pex-Al-Pex, Pex-Al-Pert )и соединительные части;Comap;S;P2;396,04;600;0103-00277;0;0
b0100012878;Набор для смесителя вентиля подводки резина №1 прокладка;1;Изоляция и уплотнение;Уплотнительные материалы;_;S;D2;13,85;22;1002-00057;&;0
b0100012958;Комплект сварочный PROFF-Z 63 ПК Контур 800Вт 20-63мм с цифр. управлением  012202020610;1;Инструмент и сварочное оборудование;Инструмент и сопутствующие товары;ПК Контур;S;D2;4 048,95;8 707,4;1201-00642;&;0
b0100013026;Соединение PP-R муфт разъемн Дн20 ПК Контур 011317020010;32;Трубопроводы и соединительные части;Труба полипропиленовая (PP-R)и соединительные части;ПК Контур;Z;D0;35,25;75,8;0105-01150;&;0
b0100013027;Соединение PP-R муфт разъемн Дн25 ПК Контур 011317025010;20;Трубопроводы и соединительные части;Труба полипропиленовая (PP-R)и соединительные части;ПК Контур;Z;D0;44,83;96,4;0105-01151;&;0
b0100013066;Бурт PP-R трубн Дн20 ПК Контур 011309020000;830;Трубопроводы и соединительные части;Труба полипропиленовая (PP-R)и соединительные части;ПК Контур;Q;D0;4,55;9,8;0105-01152;&;0
b0100013609;Конвектор Универсал ТБ-А КСК-20 0,400кВт прох без з/у резьба прав/лев тип У1 Сантехпром;1;Отопительное оборудование;Конвекторы;Сантехпром;Z;NL;853,56;1 280;0501-01873;@;0
b0100013925;Кран шаровой сталь вода КШЦФ Ду50 Ру40 фл полный проход рычаг LD 11110500402MULD000000000;3;Запорная арматура;Краны;LD;S;D1;1 529,55;1 980;0301-00723;@;0
b0100013996;Муфта латунь переходн никель Ду1 1/2"х2" ВР General Fittings;4;Трубопроводы и соединительные части;Латунные и чугунные соединительные части трубопроводов;General Fittings;S;D0;356,59;533,52;0111-01188;&;0
b0100013992;Клапан термостатическ  Ду15 прям Giacomini R402X133;1;Отопительное оборудование;Регулирующая арматура и узлы подключения для приборов отопления;Giacomini;Q;NL;306,92;407,01;0503-00186;&;0
b0100014111;Тройник латунь Дн26х1/2"х26 пресс ВР Valtec VTm.232.N.260426;3;Трубопроводы и соединительные части;Труба металлопластиковая (Pex-Al-Pex, Pex-Al-Pert )и соединительные части;Valtec;Z;NL;249,15;452;0103-00997;&;0
b0100014115;Клапан запорн латунь 15б3р Ду15 Ру10  ВР/ВР  STC 0100;20;Запорная арматура;Клапаны;STC;S;D1;100,09;183,33;0304-00001;&;0
b0100014116;Клапан запорн латунь 15б3р Ду20 Ру10  ВР/ВР  STC 0100;105;Запорная арматура;Клапаны;STC;S;P2;131,75;242,57;0304-00002;&;0
b0100014117;Клапан запорн латунь 15б3р Ду25 Ру10  ВР/ВР  STC 0100;30;Запорная арматура;Клапаны;STC;S;D0;193,04;355,94;0304-00003;&;0
b0100014118;Клапан запорн латунь 15б3р Ду32 Ру10  ВР/ВР  STC 0100;10;Запорная арматура;Клапаны;STC;S;D0;344,71;633,75;0304-00004;&;0
b0100014119;Клапан запорн латунь 15б3р Ду40 Ру10 ВР/ВР STC 0100;37;Запорная арматура;Клапаны;STC;S;P2;422,26;1 057,61;0304-00031;&;0
b0100014120;Клапан запорн латунь 15б3р Ду50 Ру10 ВР/ВР STC 0100;1;Запорная арматура;Клапаны;STC;S;D2;679,71;1 249,12;0304-00303;&;0
b0100014123;Клапан запорн латунь 15б1п Ду20 Ру16 ВР/ВР STC 0200;53;Запорная арматура;Клапаны;STC;S;D0;134,82;261,98;0304-00006;&;0
b0100014124;Клапан запорн латунь 15б1п Ду25 Ру16 ВР/ВР STC 0200;31;Запорная арматура;Клапаны;STC;S;D0;183,33;385,05;0304-00007;&;0
b0100014125;Клапан запорн латунь 15б1п Ду32 Ру16 ВР/ВР STC 0200;28;Запорная арматура;Клапаны;STC;S;D0;322,24;647,54;0304-00050;&;0
b0100014126;Клапан запорн латунь 15б1п Ду40 Ру16 ВР/ВР STC 0200;2;Запорная арматура;Клапаны;STC;S;D2;498,42;1 089,28;0304-00008;&;0
b0100014132;Затвор дисковый поворотный  Ду300 Ру16 межфл рукоятка чуг.,диск-чуг,EPDМ,110С КВАНТ;1;Запорная арматура;Затворы;КВАНТ;S;P2;8 733,81;13 232;0303-00226;F;0
b0100005347;Паста уплотнительн 65гр Unipak;4;Изоляция и уплотнение;Уплотнительные материалы;Unipak;S;D0;141,78;220;1002-00235;&;0
b0100005239;Задвижка аналог МЗВ  чугун Ду50 Ру16 75С КНР;2;Запорная арматура;Задвижки;КНР;S;P2;2 088,43;2 996;0302-00079;0;0
b0100005275;Угольник PP-R комбинированн белый Дн25х3/4" НР ПК Контур 011411025200;129;Трубопроводы и соединительные части;Труба полипропиленовая (PP-R)и соединительные части;ПК Контур;S;P2;51,2;110,1;0105-00029;@;0
b0100005277;Угольник PP-R комбинированн белый Дн25х1/2" НР ПК Контур 011411025100;22;Трубопроводы и соединительные части;Труба полипропиленовая (PP-R)и соединительные части;ПК Контур;S;D0;39,94;85,9;0105-00777;@;0
b0100010491;Вакуум-клапан PP Ду50;6;Водоотведение;Трубы для внутреннего водоотведения и соед части;_;S;D0;61,35;92;0201-00555;&;0
b0100010621;Комплект  универ  монтажн Ду20 в блистере 7предметов Ogint;86;Отопительное оборудование;Радиаторы;Ogint;S;Pz;103,67;171,08;0502-00030;@;0
b0100010623;Радиатор биметалл M Series 500 6 секций 1,080кВт Ogint;15;Отопительное оборудование;Радиаторы;Ogint;S;D0;3 004,8;3 422,05;0502-00075;@;0
b0100013542;Резак для ПП труб JRF PC-207 ПК Контур (0-40мм)  012400207010;8;Инструмент и сварочное оборудование;Инструмент и сопутствующие товары;ПК Контур;S;D0;465,05;1 000,1;1201-00644;&;0
b0100030517;Кран шаровой сталь DZT Ду65 Ру16 п/привар 150C Broen 4110216065;4;Запорная арматура;Краны;Broen;S;P2;3 031,57;4 286;0301-00457;F;0
b0100030627;Сифон для умывальника/мойки 1 1/2"х40/50 бутылочный с гофрой нерж/сетка АНИ С0115;10;Сантехника;Комплектующие и аксессуары к сантехнике;АНИ;S;D0;103;153;0908-00041;&;0
b0100030698;Угольник ПНД компрессия  Дн32х3/4" НР Unidelta;2;Трубопроводы и соединительные части;Труба полиэтиленовая (ПЭ, ПНД) и соединительные части;Unidelta;Q;D0;74,89;99;0107-00685;&;0
b0100030699;Тройник ПНД компрессия  Дн32х1"х32 ВР Unidelta;8;Трубопроводы и соединительные части;Труба полиэтиленовая (ПЭ, ПНД) и соединительные части;Unidelta;Q;D0;84,74;112;0107-00686;&;0
b0100030700;Муфта ПНД компрессия  Дн20х1/2" НР Unidelta;10;Трубопроводы и соединительные части;Труба полиэтиленовая (ПЭ, ПНД) и соединительные части;Unidelta;Q;D0;28,56;38;0107-00687;&;0
b0100030702;Муфта ПНД компрессия  Дн25х3/4" НР Unidelta;6;Трубопроводы и соединительные части;Труба полиэтиленовая (ПЭ, ПНД) и соединительные части;Unidelta;Q;D0;30,73;46;0107-00689;&;0
b0100030799;Теплосчетчик Sensostar 2 обрат 1,5м3/ч Ду15 Engelmann;34;Приборы учета и КИП;Теплосчетчики;Engelmann;S;P2;6 503,39;9 393;0705-00411;0;0
b0100030817;Тройник ПНД компрессия  Дн50х32х50;18;Трубопроводы и соединительные части;Труба полиэтиленовая (ПЭ, ПНД) и соединительные части;_;Z;D0;215;286;0107-00693;&;0
b9300043373;Каболка (ведро, уд.вес 25 кг) 10мм;1;Изоляция и уплотнение;Уплотнительные материалы;_;S;P2;1 534;2 850;1002-00285;&;0
b9300043933;Труба PERT красный Дн16x2,0 для теплого пола бухта 100м ПК Контур 060100016000;1 000;Трубопроводы и соединительные части;Труба из сшитого полиэтилена (Pex)и соединительные части;ПК Контур;Z;D0;22,6;57,2;;&;0
b9300043978;Кран шаровой латунь 11б27п1 Ду25 ВР/нак.г полный проход рычаг БАЗ;10;Запорная арматура;Краны;БАЗ;Z;D0;384,75;510;0301-02414;&;0
b9300043979;Кран шаровой латунь 11б27п1 Ду25 ВР/НР рычаг БАЗ А300мр;196;Запорная арматура;Краны;БАЗ;Z;D0;265,33;378;0301-02204;&;0
b9300043980;Кран шаровой латунь 11б27п1 Ду20 ВР/НР рычаг БАЗ А300мр;190;Запорная арматура;Краны;БАЗ;Z;D0;151,78;220;0301-01220;&;0
b9300043981;Кран шаровой латунь 11б27п1 Ду15 ВР/НР рычаг БАЗ А300мр;166;Запорная арматура;Краны;БАЗ;Z;D0;98,38;138;0301-00300;&;0
b9300043982;Кран шаровой латунь 11б27п1 Ду20 ВР/НР бабочка БАЗ А301мр;174;Запорная арматура;Краны;БАЗ;Z;D0;151,78;212;0301-01221;&;0
b9300044066;Фильтр сетчатый латунь Ф-15Р Ду15 Ру16 ВР/ВР 120C ВЕНД;34;Регулирующая и предохр арматура и автоматика;Фильтры и грязевики;ВЕНД;Z;D0;110;165;;&;0
b9300044301;Муфта PP-R комбинированн разъемн Дн40х1 1/4" НР ПК Контур 011301040401;25;Трубопроводы и соединительные части;Труба полипропиленовая (PP-R)и соединительные части;ПК Контур;Z;D0;255,38;549,2;0105-01608;@;0
b0100016419;Фильтр сетчатый латунь Ду25 ВР/ВР БАЗ 036-0295;59;Регулирующая и предохр арматура и автоматика;Фильтры и грязевики;БАЗ;S;P2;301,09;452;0406-00264;0;0
b0100016420;Фильтр сетчатый латунь Ду32 ВР/ВР БАЗ;3;Регулирующая и предохр арматура и автоматика;Фильтры и грязевики;БАЗ;S;P2;390,37;595;0406-00265;0;0
b0100016485;Люк полимер  тип Л ЛПКЛМ серый/черный А15 m=25кг;18;Водоотведение;Люки и дождеприемники;_;S;D0;478,54;687;0203-00008;@;0
b0100016564;Винт-шуруп М10х80;50;Трубопроводы и соединительные части;Крепежные изделия;_;S;D0;4,2;7;0112-00193;&;0
b0100007851;Труба PEX-AL-PEX мп Дн20х2,0 Valtec V2020;563;Трубопроводы и соединительные части;Труба металлопластиковая (Pex-Al-Pex, Pex-Al-Pert )и соединительные части;Valtec;S;D0;65,99;95;0103-00918;&;0
b0100007846;Бурт PP-R с фланцем Дн50 ПК Контур 011320050000;34;Трубопроводы и соединительные части;Труба полипропиленовая (PP-R)и соединительные части;ПК Контур;S;D0;158;339,8;0105-01132;@;0
b0100007865;Переход сталь оц Дн108х57 ГОСТ 17378-2001 ПЗКТ;2;Трубопроводы и соединительные части;Труба стальная и соединительные части;ПЗКТ;S;P2;80,31;134;0101-00577;0;0
b0100007876;Клапан 904 Ду32/40/50 для невентилируемых магис HL;1;Водоотведение;Трубы для внутреннего водоотведения и соед части;HL;Z;NL;712,17;799;0304-00275;&;0
b0100007914;Задвижка 30(31)ч6бр чугун Ду80 Ру16 ЛМЗ;10;Запорная арматура;Задвижки;ЛМЗ;S;D0;1 519,8;2 325;0302-00001;&;0
b0100008043;Крепёж для труб PP Ду40;48;Трубопроводы и соединительные части;Крепежные изделия;_;S;D0;6,07;9;0112-00647;@;0
b0100019655;Картридж  для х/в SL 10" ЭФ Г 63/250  10мкм;3;Регулирующая и предохр арматура и автоматика;Фильтры и грязевики;_;Z;D0;57,01;75;0406-00429;&;0
b0100019657;Картридж  для х/в SL 10" ЭФ Г 63/250  5мкм;2;Регулирующая и предохр арматура и автоматика;Фильтры и грязевики;_;Z;D0;57,01;75;0406-00433;&;0
b0100019691;Труба НПВХ Дн160х4,0 L=1,0м Хемкор;23;Водоотведение;Трубы для наружного водоотведения и соед части;Хемкор;S;D0;198,87;281;0202-00267;@;0
b0100019702;Арматура для унитаза  ниж/подвод 2/реж Alca Plast SA08SK 1/2;1;Сантехника;Унитазы;Alca Plast;Z;D0;913,5;1 212;0902-00574;&;0
b0100019735;Болт М16х50;0;Трубопроводы и соединительные части;Крепежные изделия;_;Z;D0;63,72;71;0112-00667;&;0
b0100019814;Кран шаровой сталь DZT Ду80 Ру16 фл Broen 6410316080;3;Запорная арматура;Краны;Broen;Q;NL;5 312,18;7 586;0301-00627;&;0
b0100019853;Поддон сталь Tappo квадрат 900х900мм КНР;6;Сантехника;Кабины душевые, поддоны;КНР;S;D0;951,91;1 771;0907-00010;@;0
b0100019881;Люк полимер  тип Л ЛПКЛ черный А15 m=32кг;12;Водоотведение;Люки и дождеприемники;_;S;D1;569,7;817;0203-00009;@;0
b0100019882;Люк полимер  тип Л ЛПКЛ зеленый А15 m=32кг;27;Водоотведение;Люки и дождеприемники;_;S;D0;569,7;893;0203-00011;&;0
b0100020225;Коллектор латунь регулирующий Ду1"х3/4" ВР на 4 выхода FAR FK3824 134;6;Трубопроводы и соединительные части;Латунные и чугунные соединительные части трубопроводов;FAR;Z;NL;1 515,1;2 009;0111-01214;&;0
mt000000026;Ключ трубный рычажный Сибртех №0 литой  15757;2;Инструмент и сварочное оборудование;Инструмент и сопутствующие товары;Сибртех;S;P2;241,53;329;1201-00933;&;0
mt000000032;Набор клуппов Ду1/2"-1" SPARTA с плашкодержателем и трещеткой (6 предметов)  773335;3;Инструмент и сварочное оборудование;Инструмент и сопутствующие товары;SPARTA;S;D1;1 567,91;2 138;1201-00938;&;0
mt000000038;Трос для прочистки труб Ду6 Сибртех L=5м  92462;2;Инструмент и сварочное оборудование;Инструмент и сопутствующие товары;Сибртех;S;P2;182,35;248;1201-00944;0;0
b0100024592;Тройник PPSU Дн16 для PE-X Uponor 1008684;25;Трубопроводы и соединительные части;Труба из сшитого полиэтилена (Pex)и соединительные части;Uponor;S;P2;104,58;209,51;0104-00059;0;0
b0100020344;Унитаз-компакт Виктория косой выпуск эконом Sanita;1;Сантехника;Унитазы;Sanita;S;D1;2 880,9;4 277;0902-00577;@;0
b0100020348;Клапан обратный латунь  Ду15 Ру16 ВР/ВР пружинный Danfoss 065B8224;1;Регулирующая и предохр арматура и автоматика;Затворы, клапаны обратные;Danfoss;Z;NL;338,13;510,18;;@;0
b0100020350;Клапан обратный латунь  Ду32 Ру16 ВР/ВР пружинный Danfoss 065B8227;1;Регулирующая и предохр арматура и автоматика;Затворы, клапаны обратные;Danfoss;Q;D0;865,68;1 305,31;;&;0
b0100020358;Элемент термостатическ   жид/нап clip clap Giacomini;3;Отопительное оборудование;Регулирующая арматура и узлы подключения для приборов отопления;Giacomini;Q;NL;478,51;634,26;0503-00087;&;0
b0100020508;Гильза    L=35мм;1;Приборы учета и КИП;Комплектующие для КИП;_;Z;D0;202,03;226;;&;0
b0100020507;Гофра верхнего слива  Киров А-10/2;5;Сантехника;Унитазы;Киров;Z;D0;21,1;30;0902-00580;&;0
b0100020660;Муфта PP-R комбинированн Дн32x1" НР ПК Контур 011211032300;90;Трубопроводы и соединительные части;Труба полипропиленовая (PP-R)и соединительные части;ПК Контур;S;D0;87,1;187,3;0105-01176;@;0
b0100020900;Штуцер латунь Дн20х3/4" для PE-X ВР Uponor 1023011;23;Трубопроводы и соединительные части;Труба из сшитого полиэтилена (Pex)и соединительные части;Uponor;S;P2;278,55;558;0104-00073;0;0
b0100020999;Переход сталь Ду32х3,2-25х3,2 ПЗКТ;0;Трубопроводы и соединительные части;Труба стальная и соединительные части;ПЗКТ;S;P2;28;47;0101-01585;0;0
b0100021042;Соединение PP-R муфт разъемн Дн32 ПК Контур 011317032010;10;Трубопроводы и соединительные части;Труба полипропиленовая (PP-R)и соединительные части;ПК Контур;Z;D0;114,77;246,8;0105-01177;&;0
b0100021056;Набор для смесителя силикон Сантехник№2 прокладка Симтек;10;Изоляция и уплотнение;Уплотнительные материалы;Симтек;S;D1;10,92;18;1002-00095;&;0
