00000007875;Соединитель латунь никель Дн20х1/2" Faro ВР для мп STC 6405;111;Трубопроводы и соединительные части;Труба металлопластиковая (Pex-Al-Pex, Pex-Al-Pert )и соединительные части;STC;S;D0;67,41;115,41;0103-00108;@;0
00000007876;Соединитель латунь никель Дн20х3/4" Faro ВР для мп STC 6405;111;Трубопроводы и соединительные части;Труба металлопластиковая (Pex-Al-Pex, Pex-Al-Pert )и соединительные части;STC;S;D1;67,41;121,03;0103-00109;@;0
00000007877;Соединитель латунь никель Дн26х3/4" Faro ВР для мп STC 6405;68;Трубопроводы и соединительные части;Труба металлопластиковая (Pex-Al-Pex, Pex-Al-Pert )и соединительные части;STC;S;P2;99,07;181,29;0103-00110;@;0
00000007878;Соединитель латунь никель Дн26х1" Faro ВР для мп STC 6405;35;Трубопроводы и соединительные части;Труба металлопластиковая (Pex-Al-Pex, Pex-Al-Pert )и соединительные части;STC;S;D0;113,88;208,87;0103-00111;@;0
00000007879;Соединитель латунь никель Дн32х1" Faro ВР для мп STC 6405;41;Трубопроводы и соединительные части;Труба металлопластиковая (Pex-Al-Pex, Pex-Al-Pert )и соединительные части;STC;S;P2;137,37;252,79;0103-00112;@;0
00000007880;Муфта латунь никель Дн16х16 Faro для мп STC 6410;35;Трубопроводы и соединительные части;Труба металлопластиковая (Pex-Al-Pex, Pex-Al-Pert )и соединительные части;STC;S;D1;60,77;102,14;0103-00102;@;0
00000007881;Муфта латунь никель Дн20х20 Faro для мп STC 6410;48;Трубопроводы и соединительные части;Труба металлопластиковая (Pex-Al-Pex, Pex-Al-Pert )и соединительные части;STC;S;D0;102,65;175,67;0103-00103;@;0
00000007882;Муфта латунь никель Дн26х26 Faro для мп STC 6410;9;Трубопроводы и соединительные части;Труба металлопластиковая (Pex-Al-Pex, Pex-Al-Pert )и соединительные части;STC;S;D0;157,8;274,74;0103-00104;@;0
00000007883;Муфта латунь никель Дн32х32 Faro для мп STC 6410;19;Трубопроводы и соединительные части;Труба металлопластиковая (Pex-Al-Pex, Pex-Al-Pert )и соединительные части;STC;S;P2;205,29;384,54;0103-00105;@;0
00000007884;Муфта латунь переходн никель Дн20х16 Faro для мп STC 6415;46;Трубопроводы и соединительные части;Труба металлопластиковая (Pex-Al-Pex, Pex-Al-Pert )и соединительные части;STC;S;D1;80,18;142,48;0103-00097;@;0
00000007885;Муфта латунь переходн никель Дн26х16 Faro для мп STC 6415;25;Трубопроводы и соединительные части;Труба металлопластиковая (Pex-Al-Pex, Pex-Al-Pert )и соединительные части;STC;S;P2;111,84;208,87;0103-00098;&;0
00000007886;Муфта латунь переходн никель Дн26х20 Faro для мп STC 6415;19;Трубопроводы и соединительные части;Труба металлопластиковая (Pex-Al-Pex, Pex-Al-Pert )и соединительные части;STC;S;P2;124,09;230,83;0103-00099;@;0
00000007888;Муфта латунь переходн никель Дн26х32 Faro для мп STC 6415;7;Трубопроводы и соединительные части;Труба металлопластиковая (Pex-Al-Pex, Pex-Al-Pert )и соединительные части;STC;S;P2;211,42;362,58;0103-00101;@;0
00000007889;Тройник латунь никель Дн16х16х16 Faro для мп STC 6420;31;Трубопроводы и соединительные части;Труба металлопластиковая (Pex-Al-Pex, Pex-Al-Pert )и соединительные части;STC;S;D1;98,05;176,18;0103-00140;@;0
00000007890;Тройник латунь никель Дн20х20х20 Faro для мп STC 6420;55;Трубопроводы и соединительные части;Труба металлопластиковая (Pex-Al-Pex, Pex-Al-Pert )и соединительные части;STC;S;D1;151,67;255,34;0103-00141;@;0
00000007891;Тройник латунь никель Дн26х26х26 Faro для мп STC 6420;48;Трубопроводы и соединительные части;Труба металлопластиковая (Pex-Al-Pex, Pex-Al-Pert )и соединительные части;STC;S;D0;245,64;420,29;0103-00142;@;0
00000007892;Тройник латунь никель Дн32х32х32 Faro для мп STC 6420;1;Трубопроводы и соединительные части;Труба металлопластиковая (Pex-Al-Pex, Pex-Al-Pert )и соединительные части;STC;S;P2;355,94;608,73;0103-00143;@;0
00000007893;Тройник латунь переходн никель Дн16х20х16 Faro для мп STC 6425;4;Трубопроводы и соединительные части;Труба металлопластиковая (Pex-Al-Pex, Pex-Al-Pert )и соединительные части;STC;S;P2;109,8;204,78;0103-00120;0;0
00000007894;Тройник латунь переходн никель Дн20х16х20 Faro для мп STC 6425;48;Трубопроводы и соединительные части;Труба металлопластиковая (Pex-Al-Pex, Pex-Al-Pert )и соединительные части;STC;S;P2;140,95;237,98;0103-00121;@;0
00000007897;Тройник латунь переходн никель Дн26х16х26 Faro для мп STC 6425;40;Трубопроводы и соединительные части;Труба металлопластиковая (Pex-Al-Pex, Pex-Al-Pert )и соединительные части;STC;S;P2;209,89;346,75;0103-00124;@;0
00000007898;Тройник латунь переходн никель Дн26х20х26 Faro для мп STC 6425;42;Трубопроводы и соединительные части;Труба металлопластиковая (Pex-Al-Pex, Pex-Al-Pert )и соединительные части;STC;S;D0;215,51;368,71;0103-00125;@;0
00000007900;Тройник латунь переходн никель Дн32х20х32 Faro для мп STC 6425;1;Трубопроводы и соединительные части;Труба металлопластиковая (Pex-Al-Pex, Pex-Al-Pert )и соединительные части;STC;S;P2;172,16;495,36;0103-00127;0;0
00000007901;Тройник латунь переходн никель Дн32х26х32 Faro для мп STC 6425;1;Трубопроводы и соединительные части;Труба металлопластиковая (Pex-Al-Pex, Pex-Al-Pert )и соединительные части;STC;S;P2;328,88;561,24;0103-00128;@;0
00000007902;Тройник латунь переходн никель Дн16х1/2"х16 Faro ВР для мп STC 6430;13;Трубопроводы и соединительные части;Труба металлопластиковая (Pex-Al-Pex, Pex-Al-Pert )и соединительные части;STC;S;D1;86,82;148,61;0103-00129;@;0
00000007903;Тройник латунь переходн никель Дн20х3/4"х20 Faro ВР для мп STC 6430;37;Трубопроводы и соединительные части;Труба металлопластиковая (Pex-Al-Pex, Pex-Al-Pert )и соединительные части;STC;S;P2;137,37;253,3;0103-00130;@;0
00000007904;Тройник латунь переходн никель Дн26х3/4"х26 Faro ВР для мп STC 6430;24;Трубопроводы и соединительные части;Труба металлопластиковая (Pex-Al-Pex, Pex-Al-Pert )и соединительные части;STC;S;P2;118,5;341,13;0103-00131;&;0
00000007905;Тройник латунь переходн никель Дн26х1"х26 Faro ВР для мп STC 6430;9;Трубопроводы и соединительные части;Труба металлопластиковая (Pex-Al-Pex, Pex-Al-Pert )и соединительные части;STC;S;D0;224,7;385,05;0103-00132;@;0
00000007906;Тройник латунь переходн никель Дн32х1"х32 Faro ВР для мп STC 6430;3;Трубопроводы и соединительные части;Труба металлопластиковая (Pex-Al-Pex, Pex-Al-Pert )и соединительные части;STC;S;P2;279,85;506,08;0103-00133;@;0
00000007907;Тройник латунь переходн никель Дн16х1/2"х16 Faro НР для мп STC 6435;19;Трубопроводы и соединительные части;Труба металлопластиковая (Pex-Al-Pex, Pex-Al-Pert )и соединительные части;STC;S;D2;82,73;140,95;0103-00134;@;0
00000007908;Тройник латунь переходн никель Дн20х3/4"х20 Faro НР для мп STC 6435;11;Трубопроводы и соединительные части;Труба металлопластиковая (Pex-Al-Pex, Pex-Al-Pert )и соединительные части;STC;S;D0;137,37;253,3;0103-00135;&;0
00000007909;Тройник латунь переходн никель Дн26х3/4"х26 Faro НР для мп STC 6435;10;Трубопроводы и соединительные части;Труба металлопластиковая (Pex-Al-Pex, Pex-Al-Pert )и соединительные части;STC;S;P2;181,29;341,13;0103-00136;@;0
00000007910;Тройник латунь переходн никель Дн26х1"х26 Faro НР для мп STC 6435;6;Трубопроводы и соединительные части;Труба металлопластиковая (Pex-Al-Pex, Pex-Al-Pert )и соединительные части;STC;S;P2;225,21;385,05;0103-00137;@;0
00000007911;Тройник латунь переходн никель Дн32х1"х32 Faro НР для мп STC 6435;5;Трубопроводы и соединительные части;Труба металлопластиковая (Pex-Al-Pex, Pex-Al-Pert )и соединительные части;STC;S;P2;288,02;494,85;0103-00138;0;0
00000007913;Угольник латунь никель Дн16 Faro для мп STC 6445;15;Трубопроводы и соединительные части;Труба металлопластиковая (Pex-Al-Pex, Pex-Al-Pert )и соединительные части;STC;S;D2;75,58;126,65;0103-00163;@;0
00000007914;Угольник латунь никель Дн20 Faro для мп STC 6445;56;Трубопроводы и соединительные части;Труба металлопластиковая (Pex-Al-Pex, Pex-Al-Pert )и соединительные части;STC;S;D0;109,8;186,91;0103-00164;@;0
00000007915;Угольник латунь никель Дн26 Faro для мп STC 6445;55;Трубопроводы и соединительные части;Труба металлопластиковая (Pex-Al-Pex, Pex-Al-Pert )и соединительные части;STC;S;D0;160,35;269,64;0103-00165;@;0
00000007916;Угольник латунь никель Дн32 Faro для мп STC 6445;36;Трубопроводы и соединительные части;Труба металлопластиковая (Pex-Al-Pex, Pex-Al-Pert )и соединительные части;STC;S;P2;249,72;418,25;0103-00166;@;0
00000007919;Угольник латунь переходн никель Дн20х1/2" Faro ВР для мп STC 6450;11;Трубопроводы и соединительные части;Труба металлопластиковая (Pex-Al-Pex, Pex-Al-Pert )и соединительные части;STC;S;D0;74,05;126,65;0103-00158;@;0
00000007920;Угольник латунь переходн никель Дн20х3/4" Faro ВР для мп STC 6450;31;Трубопроводы и соединительные части;Труба металлопластиковая (Pex-Al-Pex, Pex-Al-Pert )и соединительные части;STC;S;D0;83,24;148,61;0103-00159;@;0
00000007922;Угольник латунь переходн никель Дн26х1" Faro ВР для мп STC 6450;5;Трубопроводы и соединительные части;Труба металлопластиковая (Pex-Al-Pex, Pex-Al-Pert )и соединительные части;STC;S;D0;151,16;283,43;0103-00161;@;0
00000007923;Угольник латунь переходн никель Дн32х1" Faro ВР для мп STC 6450;5;Трубопроводы и соединительные части;Труба металлопластиковая (Pex-Al-Pex, Pex-Al-Pert )и соединительные части;STC;S;D0;226,23;395,26;0103-00162;@;0
00000007924;Угольник латунь переходн никель Дн16х1/2" Faro НР для мп STC 6455;32;Трубопроводы и соединительные части;Труба металлопластиковая (Pex-Al-Pex, Pex-Al-Pert )и соединительные части;STC;S;D0;52,6;93,45;0103-00144;@;0
00000007925;Угольник латунь переходн никель Дн16х3/4" Faro НР для мп STC 6455;24;Трубопроводы и соединительные части;Труба металлопластиковая (Pex-Al-Pex, Pex-Al-Pert )и соединительные части;STC;S;P2;83,75;142,99;0103-00145;@;0
00000007926;Угольник латунь переходн никель Дн20х1/2" Faro НР для мп STC 6455;60;Трубопроводы и соединительные части;Труба металлопластиковая (Pex-Al-Pex, Pex-Al-Pert )и соединительные части;STC;S;P2;69,45;115,92;0103-00146;@;0
00000007927;Угольник латунь переходн никель Дн20х3/4" Faro НР для мп STC 6455;72;Трубопроводы и соединительные части;Труба металлопластиковая (Pex-Al-Pex, Pex-Al-Pert )и соединительные части;STC;S;P2;80,18;142,99;0103-00147;@;0
00000007928;Угольник латунь переходн никель Дн26х3/4" Faro НР для мп STC 6455;66;Трубопроводы и соединительные части;Труба металлопластиковая (Pex-Al-Pex, Pex-Al-Pert )и соединительные части;STC;S;P2;129,2;220,1;0103-00148;@;0
00000007929;Угольник латунь переходн никель Дн26х1" Faro НР для мп STC 6455;8;Трубопроводы и соединительные части;Труба металлопластиковая (Pex-Al-Pex, Pex-Al-Pert )и соединительные части;STC;S;D0;144,01;269,64;0103-00149;@;0
00000007931;Угольник латунь уст никель Дн16х1/2" Faro ВР для мп STC 6460;11;Трубопроводы и соединительные части;Труба металлопластиковая (Pex-Al-Pex, Pex-Al-Pert )и соединительные части;STC;S;D1;76,09;137,37;0103-00153;@;0
00000007932;Угольник латунь уст никель Дн20х1/2" Faro ВР для мп STC 6460;11;Трубопроводы и соединительные части;Труба металлопластиковая (Pex-Al-Pex, Pex-Al-Pert )и соединительные части;STC;S;D0;74,56;137,37;0103-00154;@;0
00000007933;Угольник латунь уст никель Дн20х3/4" Faro ВР для мп STC 6460;9;Трубопроводы и соединительные части;Труба металлопластиковая (Pex-Al-Pex, Pex-Al-Pert )и соединительные части;STC;S;P2;109,8;187,42;0103-00155;@;0
00000007935;Крест латунь никель Дн16х16х16х16 Faro для мп STC 6470;1;Трубопроводы и соединительные части;Труба металлопластиковая (Pex-Al-Pex, Pex-Al-Pert )и соединительные части;STC;S;D2;159,33;273,72;0103-00167;@;0
00000007936;Крест латунь никель Дн20х20х20х20 Faro для мп STC 6470;1;Трубопроводы и соединительные части;Труба металлопластиковая (Pex-Al-Pex, Pex-Al-Pert )и соединительные части;STC;S;D2;201,21;340,62;0103-00168;@;0
00000008009;Фильтр магнитн чугун ФМФ Ду50 Ру16 фл УЭ-148;6;Регулирующая и предохр арматура и автоматика;Фильтры и грязевики;УЭ-148;S;D0;996,64;1 510;0406-00296;&;0
00000008010;Фильтр магнитн чугун ФМФ Ду65 Ру16 фл УЭ-148;1;Регулирующая и предохр арматура и автоматика;Фильтры и грязевики;УЭ-148;S;D1;1 400,25;2 163;0406-00297;&;0
00000008012;Фильтр магнитн чугун ФМФ Ду100 Ру16 фл УЭ-148 УЭ-148;3;Регулирующая и предохр арматура и автоматика;Фильтры и грязевики;УЭ-148;S;D0;2 427,56;3 897;0406-00299;&;0
00000008032;Бобышка для термометра, манометра БП1 L=55мм M27x2 Гидрозатвор;35;Приборы учета и КИП;Комплектующие для КИП;Гидрозатвор;S;P2;50,76;81;0702-00029;&;0
00000008055;Резьба сталь удлиненн Ду20 L=50мм из труб по ГОСТ 3262-75 КАЗ;69;Трубопроводы и соединительные части;Труба стальная и соединительные части;КАЗ;S;Pz;6,63;11;0101-00733;@;0
00000008087;Евроконус латунь Дн16х3/4" ВР для мп Comap;2;Трубопроводы и соединительные части;Труба металлопластиковая (Pex-Al-Pex, Pex-Al-Pert )и соединительные части;Comap;S;D2;89,79;138;0103-00240;&;0
00000008091;Манжет переходн чугун/пластик резина Ду73х40;24;Изоляция и уплотнение;Уплотнительные материалы;_;Z;D0;11,67;15;1002-00036;&;0
00000008114;Кран шаровой латунь Faro Ду20 НР/нак.г рычаг STC 1207;57;Запорная арматура;Краны;STC;S;P2;271,17;375,86;0301-00279;@;0
00000008115;Кран шаровой латунь Faro Ду15 НР/нак.г рычаг STC 1207;98;Запорная арматура;Краны;STC;S;P2;166,99;244,1;0301-00280;@;0
00000008116;Кран шаровой латунь Faro Ду15 НР/нак.г бабочка STC 1208;17;Запорная арматура;Краны;STC;S;D2;165,97;243,59;0301-00275;@;0
00000008117;Кран шаровой латунь Faro Ду20 НР/нак.г бабочка STC 1208;171;Запорная арматура;Краны;STC;S;Pz;260,45;374,84;0301-00276;@;0
00000008118;Кран шаровой латунь Faro Ду25 НР/нак.г бабочка STC 1208;21;Запорная арматура;Краны;STC;S;D0;356,59;570,94;0301-00277;@;0
00000008143;Круг отрезной 125х2,5-4х22;80;Инструмент и сварочное оборудование;Инструмент и сопутствующие товары;_;S;D1;14,43;19;1201-00168;&;0
00000008246;Водонагреватель эл накопительный 30л верт 2кВт сталь нерж IF 30 V Thermex;1;Котлы и водонагреватели;Водонагреватели;Thermex;Q;D0;8 307,39;12 403;0601-00121;&;0
00000008304;Отвод PP-H Дн110х30° Политэк;12;Водоотведение;Трубы для внутреннего водоотведения и соед части;Политэк;S;D1;30,64;62;0201-00478;&;0
00000008305;Патрубок PP-H компенсационн Дн110 Политэк;81;Водоотведение;Трубы для внутреннего водоотведения и соед части;Политэк;S;D0;64,06;102;0201-00479;&;0
00000008320;Тройник латунь никель Ду1/2" НР/ВР/НР General Fittings;1;Трубопроводы и соединительные части;Латунные и чугунные соединительные части трубопроводов;General Fittings;S;P2;119,98;180;0111-01082;0;0
00000008330;Водонагреватель эл накопительный 50л верт 2кВт сталь нерж IF 50 V Thermex;13;Котлы и водонагреватели;Водонагреватели;Thermex;Q;D0;10 180,03;13 900;0601-00123;&;0
00000008349;Кран водоразборн латунь Faro Ду15  80C STC 1223;21;Запорная арматура;Краны;STC;S;D0;131,24;193,04;0301-00042;@;0
00000008350;Кран водоразборн латунь Faro Ду20  80C STC 1223;5;Запорная арматура;Краны;STC;S;D2;200,19;277,81;0301-00043;@;0
00000008512;Герметик силикон   универ 280гр бесцветный Момент ГБ23;4;Изоляция и уплотнение;Изоляция и термоизоляция;Момент;S;P2;137,14;208;1001-00535;&;0
00000008513;Герметик силикон   универ 280гр белый Момент ГБ21;12;Изоляция и уплотнение;Изоляция и термоизоляция;Момент;S;P2;137,28;211;1001-00536;&;0
00000008553;Манжет переходн Ду40х25;46;Изоляция и уплотнение;Уплотнительные материалы;_;S;P2;5,42;8;1002-00042;&;0
00000008555;Воздухоотводчик Ду1/2" без отсечного клапана авт Valtec VT.502.NH.04;10;Отопительное оборудование;Воздухоотводчики;Valtec;S;P2;198,43;360;0504-00047;&;0
00000008581;Полотенцесушитель сталь нерж М-образный 500х600 1";5;Сантехника;Полотенцесушители;_;S;D0;800;1 172;0911-00131;&;0
00000008614;Отвод чугун Ду100х135° Новокузнецк;0;Трубопроводы и соединительные части;Труба чугунная и соединительные части;Новокузнецк;S;D2;227,04;339;;0;0
00000008717;Лейка для душа пластик с кроншт _ Подольск;5;Сантехника;Смесители и краны для сан.узлов;Подольск;Z;D0;38,67;51;0909-00865;&;0
00000008755;Арматура МА-60 для термопреобразователя (гиль.L60+ бобыш.М20*1,5)   НПО Карат;14;Приборы учета и КИП;Теплосчетчики;НПО Карат;S;P2;261,3;363;0705-00213;@;0
00000008756;Редуктор для затвора Дн300/350 КВАНТ;2;Запорная арматура;Комплектующие и аксессуары для запорной арматуры;КВАНТ;S;P2;2 513,29;3 845;0306-00099;0;0
00000008759;Адаптер  для теплосчетчика   НПО Карат;64;Приборы учета и КИП;Теплосчетчики;НПО Карат;S;P2;120,6;173;0705-00215;&;0
00000008762;Переход сталь Дн273х159 ГОСТ 17378-2001 ПЗКТ;1;Трубопроводы и соединительные части;Труба стальная и соединительные части;ПЗКТ;S;P2;574,97;993;0101-00739;0;0
00000008764;Муфта сталь Ду20 ВР/ВР;286;Трубопроводы и соединительные части;Труба стальная и соединительные части;_;S;P2;10,29;15;0111-00383;@;0
00000008765;Муфта сталь Ду25 ВР/ВР;782;Трубопроводы и соединительные части;Труба стальная и соединительные части;_;S;P2;16,51;24;0111-00384;@;0
00000008766;Муфта сталь Ду32 по ГОСТ 8965-75 КНР;31;Трубопроводы и соединительные части;Труба стальная и соединительные части;КНР;S;Pz;34,68;51;0101-01233;&;0
00000008767;Муфта сталь Ду40 по ГОСТ 8965-75 КНР;6;Трубопроводы и соединительные части;Труба стальная и соединительные части;КНР;S;D0;44,1;65;0101-01234;&;0
00000008768;Муфта сталь Ду50 по ГОСТ 8965-75 КНР;11;Трубопроводы и соединительные части;Труба стальная и соединительные части;КНР;S;D0;61,09;90;0101-01235;&;0
00000009844;Клапан запорн RLV-KD 3/4"х3/4" прям Danfoss 003L0241;16;Отопительное оборудование;Регулирующая арматура и узлы подключения для приборов отопления;Danfoss;Z;NL;868,4;1 578,86;;@;0
